{
  "version": 1,
  "generated_at": "2026-09-02T01:29:50Z",
  "selection_policy": "GitHub bug母集団はcoverage.jsonで全34件を監査し、corpusはfailure family、runtime signal、ground-truth strength、primary classificationを層化抽出する。#102はbug labelがなくてもlocal deadline違反とmerged fixが揃うため追加する。raw state、log、worker transcriptは含めない。",
  "incidents": [
    {
      "id": "cil-github-issue-3",
      "window": {"start": "2026-08-15T11:13:12Z", "end": "2026-08-15T11:33:38Z"},
      "first_signal": {"source": "github_issue", "ref": "https://github.com/ishii1648/codex-issue-loop/issues/3"},
      "event_types": ["github_issue", "pull_request_merged"],
      "statuses": ["closed", "fixed"],
      "links": {"issues": ["https://github.com/ishii1648/codex-issue-loop/issues/3"], "pull_requests": ["https://github.com/ishii1648/codex-issue-loop/pull/27"], "commits": ["7e7c851b2f9a41ce2741b389e1b7016b587d9bd5"]},
      "symptom": "保存したユーザー回答がCodex resumeへ確実に渡らない。",
      "root_cause": "resume invocationがdurable answerをworker inputへ引き渡す契約を満たしていなかった。",
      "recovery": "PR #27でanswer handoffを修正しmergeした。",
      "product_code_change": "merged",
      "confidence": "high",
      "fingerprint": "resume:answer-handoff:missing",
      "evidence": [{"source": "github_issue", "ref": "issue:3"}, {"source": "github_pr", "ref": "pr:27"}, {"source": "git", "ref": "commit:7e7c851b2f9a41ce2741b389e1b7016b587d9bd5"}],
      "features": {"corroborated_product_fix": true, "documented_invariant_violation": true, "repeated_independent_runs": false, "typed_transient": false, "retry_deadline_respected": false, "consecutive_failures": 0, "successful_domain_event": false, "request_amplification": false, "progress_stalled": false, "human_action_required": false, "persistence_threshold_exceeded": false},
      "ground_truth": {"primary_classification": "confirmed_bug", "basis": "IssueのAPI契約違反とmerged fix commitが一致する。"},
      "secondary_attributes": ["needs_input"],
      "missing_evidence": [],
      "would_resolve_with": []
    },
    {
      "id": "cil-github-issue-92",
      "window": {"start": "2026-08-16T16:23:41Z", "end": "2026-08-17T20:56:59Z"},
      "first_signal": {"source": "github_issue", "ref": "https://github.com/ishii1648/codex-issue-loop/issues/92"},
      "event_types": ["issue_blocked", "startup_reconciled", "issue_completed", "pull_request_merged"],
      "statuses": ["blocked", "completed"],
      "links": {"issues": ["https://github.com/ishii1648/codex-issue-loop/issues/92"], "pull_requests": ["https://github.com/ishii1648/codex-issue-loop/pull/95"], "commits": ["72214e97fb18f72e214b82380e7228f6dce6f8a4"]},
      "symptom": "terminal Issueが通常cycleでmerged PRへ収束しない。",
      "root_cause": "通常reconciliationがterminal Issueのopen/merged PR lifecycleを再評価しなかった。",
      "recovery": "PR #95でterminal reconciliationを追加し、local seq 643のblockedからseq 43028のcompletedへ収束した。",
      "product_code_change": "merged",
      "confidence": "high",
      "fingerprint": "reconcile:terminal-pr:not-adopted",
      "evidence": [{"source": "event_archive", "ref": "sequence:643"}, {"source": "event_archive", "ref": "sequence:43028"}, {"source": "github_pr", "ref": "pr:95"}, {"source": "git", "ref": "commit:72214e97fb18f72e214b82380e7228f6dce6f8a4"}],
      "features": {"corroborated_product_fix": true, "documented_invariant_violation": true, "repeated_independent_runs": false, "typed_transient": true, "retry_deadline_respected": true, "consecutive_failures": 2, "successful_domain_event": true, "request_amplification": false, "progress_stalled": true, "human_action_required": true, "persistence_threshold_exceeded": true},
      "ground_truth": {"primary_classification": "confirmed_bug", "basis": "terminal convergence invariantとmerged fixがあり、後のcompleted eventで復旧を確認できる。"},
      "secondary_attributes": ["operator_attention", "recovered"],
      "missing_evidence": [],
      "would_resolve_with": []
    },
    {
      "id": "cil-github-issue-102",
      "window": {"start": "2026-08-16T18:23:15Z", "end": "2026-08-17T20:57:09Z"},
      "first_signal": {"source": "event_archive", "ref": "sequence:690"},
      "event_types": ["supervisor_retry_scheduled", "supervisor_recovered", "github_issue", "pull_request_merged"],
      "statuses": ["retrying", "rate_limited", "fixed"],
      "links": {"issues": ["https://github.com/ishii1648/codex-issue-loop/issues/102"], "pull_requests": ["https://github.com/ishii1648/codex-issue-loop/pull/120"], "commits": ["b3e1b5663ef190ee5c16f63d2fed76b37e3bf858"]},
      "symptom": "GitHub GraphQL失敗時にfsnotify wakeがbackoffを迂回しAPI retryを増幅した。",
      "root_cause": "retry stateの自己書込みがschedulerを早期wakeし、no-op cycleがfailure counterを誤resetした。",
      "recovery": "PR #120でpoll deadlineとshared cooldownを尊重するよう修正した。",
      "product_code_change": "merged",
      "confidence": "high",
      "fingerprint": "scheduler:graphql-rate-limit:deadline-bypass",
      "evidence": [{"source": "event_archive", "ref": "supervisor_retry_scheduled:27604"}, {"source": "event_archive", "ref": "candidate_deadline_bypass_pairs:26999/27603"}, {"source": "github_issue", "ref": "issue:102"}, {"source": "github_pr", "ref": "pr:120"}, {"source": "git", "ref": "commit:b3e1b5663ef190ee5c16f63d2fed76b37e3bf858"}],
      "features": {"corroborated_product_fix": true, "documented_invariant_violation": true, "repeated_independent_runs": true, "typed_transient": true, "retry_deadline_respected": false, "consecutive_failures": 4, "successful_domain_event": false, "request_amplification": true, "progress_stalled": true, "human_action_required": true, "persistence_threshold_exceeded": true},
      "ground_truth": {"primary_classification": "confirmed_bug", "basis": "26,999のtimestamp候補組、Issueで特定したcode原因、merged fixが裏付ける。attempt IDがないため候補組を全件確定違反とは扱わない。"},
      "secondary_attributes": ["degraded", "rate_limit", "operator_attention"],
      "missing_evidence": [],
      "would_resolve_with": []
    },
    {
      "id": "cil-github-issue-124",
      "window": {"start": "2026-08-17T20:12:09Z", "end": "2026-08-17T20:36:53Z"},
      "first_signal": {"source": "github_issue", "ref": "https://github.com/ishii1648/codex-issue-loop/issues/124"},
      "event_types": ["process_sample", "fsnotify_wake", "pull_request_merged"],
      "statuses": ["polling", "fixed"],
      "links": {"issues": ["https://github.com/ishii1648/codex-issue-loop/issues/124"], "pull_requests": ["https://github.com/ishii1648/codex-issue-loop/pull/125"], "commits": ["74027ae3b03e09d29e2cb4cf3d5216cd5a1a3b90"]},
      "symptom": "idle supervisorが約1 CPUを消費し、poll timerとready queueが進まない。",
      "root_cause": "Store.Loadの無条件chmodをfsnotifyが自己検知し、state全読込みを繰り返した。",
      "recovery": "PR #125でmodeが正しい読込pathのchmodと自己wakeを抑止した。",
      "product_code_change": "merged",
      "confidence": "high",
      "fingerprint": "state-load:chmod:fsnotify-self-wake",
      "evidence": [{"source": "github_issue", "ref": "issue:124"}, {"source": "github_pr", "ref": "pr:125"}, {"source": "git", "ref": "commit:74027ae3b03e09d29e2cb4cf3d5216cd5a1a3b90"}],
      "features": {"corroborated_product_fix": true, "documented_invariant_violation": true, "repeated_independent_runs": true, "typed_transient": false, "retry_deadline_respected": false, "consecutive_failures": 0, "successful_domain_event": false, "request_amplification": true, "progress_stalled": true, "human_action_required": true, "persistence_threshold_exceeded": true},
      "ground_truth": {"primary_classification": "confirmed_bug", "basis": "2 supervisorのprocess sample、特定code path、merged regression fixが揃う。"},
      "secondary_attributes": ["degraded", "resource_exhaustion"],
      "missing_evidence": [],
      "would_resolve_with": []
    },
    {
      "id": "cil-github-issue-134",
      "window": {"start": "2026-08-17T22:37:37Z", "end": "2026-08-18T02:57:06Z"},
      "first_signal": {"source": "github_issue", "ref": "https://github.com/ishii1648/codex-issue-loop/issues/134"},
      "event_types": ["retry_scheduled", "issue_blocked", "pull_request_merged"],
      "statuses": ["retry_wait", "blocked", "fixed"],
      "links": {"issues": ["https://github.com/ishii1648/codex-issue-loop/issues/134"], "pull_requests": ["https://github.com/ishii1648/codex-issue-loop/pull/140"], "commits": ["7764befb3439d0b830b5d3968f9a5e703a627e67"]},
      "symptom": "worker environment blockがrepository resource leaseを保持し後続queueを止める。",
      "root_cause": "environment blockをdurable parkとして扱うlease transitionがなかった。",
      "recovery": "PR #140でenvironment resource parkと後続claimを実装した。",
      "product_code_change": "merged",
      "confidence": "high",
      "fingerprint": "lease:environment-block:not-parked",
      "evidence": [{"source": "event_archive", "ref": "sequence:43249-43274"}, {"source": "github_issue", "ref": "issue:134"}, {"source": "github_pr", "ref": "pr:140"}, {"source": "git", "ref": "commit:7764befb3439d0b830b5d3968f9a5e703a627e67"}],
      "features": {"corroborated_product_fix": true, "documented_invariant_violation": true, "repeated_independent_runs": false, "typed_transient": true, "retry_deadline_respected": true, "consecutive_failures": 1, "successful_domain_event": false, "request_amplification": false, "progress_stalled": true, "human_action_required": true, "persistence_threshold_exceeded": false},
      "ground_truth": {"primary_classification": "confirmed_bug", "basis": "queue liveness invariant、typed events、merged fixが揃う。"},
      "secondary_attributes": ["operator_attention", "resource_park"],
      "missing_evidence": [],
      "would_resolve_with": []
    },
    {
      "id": "cil-github-issue-146",
      "window": {"start": "2026-08-18T05:26:54Z", "end": "2026-08-18T05:44:12Z"},
      "first_signal": {"source": "github_issue", "ref": "https://github.com/ishii1648/codex-issue-loop/issues/146"},
      "event_types": ["environment_resume", "retry_scheduled", "supervisor_blocked", "pull_request_merged"],
      "statuses": ["resumed", "retry_wait", "blocked", "fixed"],